{
  "preset_id": "replayable-coop",
  "version": 1,
  "emphasis": [
    "협동 과정에서 역할 간 상호 의존과 반복마다 달라지는 선택을 드러낸다.",
    "개인 행동이 팀의 상황 인식과 다음 판단에 주는 영향을 명시한다."
  ],
  "review_questions": [
    "한 참여자의 선택이 다른 참여자에게 읽히고 대응 가능한가?",
    "반복 플레이가 단순 수치 변화가 아니라 새로운 판단을 만들 수 있는가?"
  ],
  "recommended_diagrams": [
    "역할별 행동, 전달 신호와 상호 지원 관계 도식",
    "상황 변화에 따른 팀 판단과 대응 분기 도식"
  ],
  "story_hints": [
    "공동 목표, 역할별 기여, 변화 신호, 팀 대응, 다음 반복의 학습 순서로 설명한다."
  ],
  "additional_acceptance_criteria": [
    "협동 규칙은 역할별 기여, 실패 회복, 의사소통 신호와 반복 다양성의 검증 방법을 포함한다."
  ]
}
