{
  "preset_id": "ugc-production-tooling",
  "version": 1,
  "emphasis": [
    "제작자의 작성, 검토, 시험, 게시와 수정 흐름을 하나의 운영 계약으로 연결한다.",
    "도구의 상태, 책임, 오류와 회복 경로를 제작 단계별로 명시한다."
  ],
  "review_questions": [
    "제작자가 각 단계의 현재 상태, 다음 행동과 실패 원인을 알 수 있는가?",
    "검토와 게시 이후에도 수정, 회수와 복구가 추적 가능한가?"
  ],
  "recommended_diagrams": [
    "작성에서 검토, 시험, 게시, 갱신과 회수로 이어지는 상태 도식",
    "제작자, 검토자, 실행 환경과 운영 책임의 전달 도식"
  ],
  "story_hints": [
    "제작 목표, 작성 단계, 검증 기준, 게시 판단, 운영과 회복 순서로 설명한다."
  ],
  "additional_acceptance_criteria": [
    "제작 흐름은 단계별 입력, 출력, 권한, 검증, 오류 표시, 되돌림과 책임자를 정의한다."
  ]
}
